{
  "$schema": "https://raw.githubusercontent.com/MonetizeKit/.github/v1/schemas/agent-policy.schema.json",
  "schema_version": 1,
  "policy_version": "1.4.0",
  "reviewed_at": "2026-09-14",
  "review_due": "2026-12-14",
  "gateway": {
    "provider": "vercel-ai-gateway",
    "base_url": "https://ai-gateway.vercel.sh/v1",
    "models_endpoint": "https://ai-gateway.vercel.sh/v1/models",
    "credential_env": "AI_GATEWAY_API_KEY",
    "anthropic_compatible_base_url": "https://ai-gateway.vercel.sh"
  },
  "tiers": {
    "triage": {
      "purpose": "Short classification and summarisation over logs or diffs: build-failure triage, drift summaries, failure categorisation.",
      "model": "anthropic/claude-haiku-4.5",
      "fallback": "anthropic/claude-sonnet-4.6"
    },
    "review": {
      "purpose": "Code and document review lenses, verification subagents, evals: needs tool use and long context at moderate cost.",
      "model": "anthropic/claude-sonnet-5",
      "fallback": "anthropic/claude-sonnet-4.6"
    },
    "judgment": {
      "purpose": "Security and architecture lenses and the production-promotion summary, where a missed finding is expensive.",
      "model": "anthropic/claude-opus-5",
      "fallback": "anthropic/claude-opus-4.8"
    },
    "second-opinion": {
      "purpose": "The non-Anthropic member of every two-provider quorum.",
      "model": "openai/gpt-5.5",
      "fallback": "openai/gpt-5.4"
    },
    "support": {
      "purpose": "Customer-facing support chat: fast, cheap, no tools, public docs only.",
      "model": "anthropic/claude-haiku-4.5",
      "fallback": "anthropic/claude-sonnet-4.6"
    }
  },
  "roles": {
    "author": {
      "description": "Interactive authoring session (Cursor Cloud Agent, Cursor IDE, Claude Code) writing code against a spec. The engineer chooses the model; this policy governs tools, data and autonomy.",
      "model_selection": "operator",
      "route": "cursor-cloud-agent",
      "tools": ["Bash", "Read", "Write", "Edit", "Grep", "Glob", "WebFetch"],
      "data_classes": ["public", "internal", "secrets-redacted"],
      "autonomy": { "development": "propose", "delivery": "read-only", "production": "read-only" },
      "human_gate": true,
      "owner": "@EtherealVisions",
      "surfaces": ["app-monetizekit-monorepo:AGENTS.md", "app-monetizekit-monorepo:.cursor/hooks.json", "app-monetizekit-monorepo:.claude/settings.json"],
      "status": "active",
      "evals_fixture": "app-monetizekit-monorepo:evals/tasks"
    },
    "planner": {
      "description": "Interactive planning session producing intent.md, plan.md and spec updates from Kiro specs and steering docs. Never edits implementation code.",
      "model_selection": "operator",
      "route": "cursor-cloud-agent",
      "tools": ["Read", "Grep", "Glob", "Write"],
      "data_classes": ["public", "internal"],
      "autonomy": { "development": "propose", "delivery": "none", "production": "none" },
      "human_gate": true,
      "owner": "@EtherealVisions",
      "surfaces": ["app-monetizekit-monorepo:.cursor/commands/kiro-intent.md", "app-monetizekit-monorepo:.cursor/commands/kiro-plan.md", "app-monetizekit-monorepo:.cursor/skills/kiro-planning.md"],
      "status": "active"
    },
    "verifier-subagent": {
      "description": "Fresh-context subagent that re-runs the verification block of AGENTS.md against an author's change and reports pass/fail; it never edits.",
      "model_selection": "policy",
      "tier": "review",
      "model": "anthropic/claude-sonnet-5",
      "fallback": "anthropic/claude-sonnet-4.6",
      "route": "cursor-cloud-agent",
      "tools": ["Bash(pnpm*)", "Bash(git diff*)", "Bash(git status*)", "Read", "Grep", "Glob"],
      "data_classes": ["public", "internal", "secrets-redacted"],
      "autonomy": { "development": "read-only", "delivery": "read-only", "production": "none" },
      "human_gate": false,
      "owner": "@EtherealVisions",
      "surfaces": ["app-monetizekit-monorepo:docs/engineering/agent-delegation-architecture.md"],
      "status": "active"
    },
    "shadow-reviewer": {
      "description": "Four-lens PR reviewer (security, testing, internal docs, external docs) posting one advisory comment; never blocks. Graduates lens by lens per metrics-policy.json burn-in.",
      "model_selection": "policy",
      "tier": "review",
      "model": "anthropic/claude-sonnet-5",
      "fallback": "anthropic/claude-sonnet-4.6",
      "route": "gateway",
      "budget": { "max_usd_per_run": 2.0, "max_output_tokens": 16000 },
      "tools": ["Bash(git*)", "Read", "Grep", "Glob", "Write"],
      "data_classes": ["public", "internal", "secrets-redacted"],
      "autonomy": { "development": "read-only", "delivery": "read-only", "production": "read-only" },
      "human_gate": false,
      "owner": "@EtherealVisions",
      "surfaces": [".github:.github/workflows/reusable-pr-review.yml"],
      "status": "shadow",
      "prompt_version_env": "PROMPT_VERSION",
      "evals_fixture": "app-monetizekit-monorepo:evals/tasks/review-flags-pii-log.json"
    },
    "stage-review": {
      "description": "Batched 17-lens review of the development SHA feeding Stage Gate / development. Default lens model; security-review and architecture-review use the judgment tier (see stage-review:security-review, stage-review:architecture-review).",
      "model_selection": "policy",
      "tier": "review",
      "model": "anthropic/claude-sonnet-5",
      "fallback": "anthropic/claude-sonnet-4.6",
      "route": "gateway",
      "budget": { "max_usd_per_run": 15.0, "max_output_tokens": 64000, "max_runs_per_day": 12 },
      "tools": ["Bash(git*)", "Read", "Grep", "Glob", "Write"],
      "data_classes": ["public", "internal", "secrets-redacted"],
      "autonomy": { "development": "read-only", "delivery": "none", "production": "none" },
      "human_gate": false,
      "owner": "@EtherealVisions",
      "surfaces": ["app-monetizekit-monorepo:.github/workflows/stage-review.yml"],
      "status": "shadow",
      "prompt_version_env": "STAGE_REVIEW_PROMPT_VERSION",
      "evals_fixture": "app-monetizekit-monorepo:evals/lenses"
    },
    "stage-review:security-review": {
      "description": "Security lens of the stage review: judges what CodeQL, the audit ratchet and the security registry cannot.",
      "model_selection": "policy",
      "tier": "judgment",
      "model": "anthropic/claude-opus-5",
      "fallback": "anthropic/claude-opus-4.8",
      "route": "gateway",
      "budget": { "max_usd_per_run": 5.0, "max_output_tokens": 16000 },
      "tools": ["Bash(git*)", "Read", "Grep", "Glob", "Write"],
      "data_classes": ["public", "internal", "secrets-redacted"],
      "autonomy": { "development": "read-only", "delivery": "none", "production": "none" },
      "human_gate": false,
      "owner": "@EtherealVisions",
      "surfaces": ["app-monetizekit-monorepo:.github/workflows/stage-review.yml"],
      "status": "shadow",
      "evals_fixture": "app-monetizekit-monorepo:evals/lenses/security-review"
    },
    "stage-review:architecture-review": {
      "description": "Architecture lens of the stage review: boundary violations, ADR conformance, blast radius.",
      "model_selection": "policy",
      "tier": "judgment",
      "model": "anthropic/claude-opus-5",
      "fallback": "anthropic/claude-opus-4.8",
      "route": "gateway",
      "budget": { "max_usd_per_run": 5.0, "max_output_tokens": 16000 },
      "tools": ["Bash(git*)", "Read", "Grep", "Glob", "Write"],
      "data_classes": ["public", "internal"],
      "autonomy": { "development": "read-only", "delivery": "none", "production": "none" },
      "human_gate": false,
      "owner": "@EtherealVisions",
      "surfaces": ["app-monetizekit-monorepo:.github/workflows/stage-review.yml"],
      "status": "shadow",
      "evals_fixture": "app-monetizekit-monorepo:evals/lenses/architecture-review"
    },
    "stage-review:marketing-images": {
      "description": "Vision pass over changed marketing and OG images for brand conformance; advisory until calibrated.",
      "model_selection": "policy",
      "tier": "review",
      "model": "anthropic/claude-sonnet-5",
      "fallback": "anthropic/claude-sonnet-4.6",
      "route": "gateway",
      "budget": { "max_usd_per_run": 2.0, "max_output_tokens": 8000 },
      "tools": ["Read", "Glob", "Write"],
      "data_classes": ["public"],
      "autonomy": { "development": "read-only", "delivery": "none", "production": "none" },
      "human_gate": false,
      "owner": "@EtherealVisions",
      "surfaces": ["app-monetizekit-monorepo:.github/workflows/stage-review.yml"],
      "status": "planned"
    },
    "docs-impact-quorum": {
      "description": "Two-provider quorum countersigning a PR's docs-impact attestation. Both models must approve; a human owner comment is the fallback.",
      "model_selection": "policy",
      "tier": "judgment",
      "model": "anthropic/claude-opus-4.8",
      "fallback": "anthropic/claude-opus-5",
      "quorum": { "required": true, "models": ["anthropic/claude-opus-4.8", "openai/gpt-5.5"] },
      "route": "gateway",
      "budget": { "max_usd_per_run": 3.0, "max_output_tokens": 8000 },
      "tools": [],
      "data_classes": ["public", "internal"],
      "autonomy": { "development": "act", "delivery": "act", "production": "act" },
      "human_gate": true,
      "owner": "@EtherealVisions",
      "surfaces": ["app-monetizekit-monorepo:.github/docs-impact-approval-policy.json", "app-monetizekit-monorepo:scripts/docs/review-content-impact-with-llm.mjs", "app-monetizekit-monorepo:.github/workflows/ci-docs-validation.yml"],
      "status": "active"
    },
    "promotion-docs-review": {